title,genres,overview,tmdb_id
Rang De Basanti,Comedy|Drama|History|Romance,"After a group of friends graduate from Delhi University, they listlessly haunt their old campus, until a British filmmaker casts them in a film she's making about freedom fighters under British rule. Although the group is largely apolitical, the tragic death of a friend owing to local government corruption awakens their patriotism. Inspired by the freedom fighters they represent in the film, the friends collectively decide to avenge the killing.",7913.0
Stree,Horror|Comedy,"Set in the town of Chanderi, Stree is based on the urban legend of Nale Ba that went viral in Karnataka in the 1990s, and features Shraddha Kapoor and Rajkummar Rao in pivotal roles.",533991.0
Andaz Apna Apna,Comedy|Romance|Family,Two slackers competing for the affections of an heiress inadvertently become her protectors from an evil criminal.,58128.0
Dhadak,Romance|Drama|Comedy,"Madhukar and Parthavi fall head over heels in love with each other, but the fact that they belong to different castes of society, becomes an obstacle in their romance. The lovers dare to go against societal norms and battle all odds for the sake of love.",504080.0
Talvar,Thriller|Drama|Mystery,A hardened cop deals with three conflicting perspectives involving a brutal double murder. The case is complicated as the prime suspects are the parents who supposedly killed their teenage daughter.,353464.0
Paheli,Romance|Drama|Fantasy,"Kishanlal marries the beautiful Lachchi, but the day after the wedding, he leaves on business for five years. When Kishanlal reappears only a few days later, Lachchi is delighted, but this new Kishanlal is in fact a spirit who has taken the form of Lachchi's husband, after having seen her by chance and fallen in love with her. Four years later, the real Kishanlal returns and the townsfolk must determine who is who.",33081.0
M.S. Dhoni: The Untold Story,Drama,"Based on the life story of Mahendra Singh Dhoni, and his journey to being the world cup winning captain of the Indian cricket team.",388333.0
Chandni Chowk to China,Action|Adventure|Comedy,A cook from Chandni Chowk gets mistaken for the reincarnation of an ancient peasant warrior by the residents of an oppressed Chinese village.,20002.0
Mughal-e-Azam,Drama|Romance,"In the 16th century, when Prince Salim falls in love with a beautiful courtesan named Anarkali, Emperor Akbar's disapproval leads to a battle between father and son.",44519.0
Brothers,Action|Drama,"David and Monty, estranged half-brothers, train in mixed martial arts to earn a livelihood. However, things change when the two are forced to compete against each other in the final tournament.",330037.0
Badlapur,Crime|Thriller|Action|Drama,"After his wife and son are killed, a young man finds out the man behind the murder and fights against him, along committing some big mistakes.",323517.0
Masti,Comedy|Crime|Mystery,"Three henpecked friends try to escape their unhappy marriages by seeking out some extramarital fun, only to end up being blackmailed.",76684.0
Dhol,Comedy,"Pankaj , Gautam, Sameer and Martand are roommates in Pune who are bound together by their ambition to make it big in life with the least effort possible. Each one tries his hand at finding a shortcut to success but ends up being in even deeper trouble. Things get worse when the four decide to take a loan at high interest which they are unable to pay back. They believe that the only way to get rich without working hard is to marry the wealthy girl in their neighborhood and each of the four friends embark on their individual plans to woo her.",19418.0
Singham,Drama|Action|Crime,"An honest, small town cop is transferred to a big city that is controlled by a crime boss that he had once humiliated.",70590.0
Biwi No.1,Comedy|Drama|Romance,"Two adorable kids, a quirky mother-in-law and a happy-go-lucky friend help a heartbroken wife bring a straying husband back from the other woman's tangled embrace.",161226.0
Captain Miller,Action|War,"In the 1930s, during the British Raj, Analeesan ""Eesa"", a former soldier of the British Indian Army called Captain Miller, is on a mission to protect the people from the British after witnessing an atrocity.",962074.0
7Aum Arivu,Action|Science Fiction|Thriller,A genetic engineering student tries to bring back the skills of a legend of the past and use his skills to save India from a deadly virus attack by China.,86718.0
Anbe Sivam,Comedy|Drama,"Anbarasu, young and arrogant, and Nallasivam, damaged - physically but not spiritually - by life, are thrown together by circumstances, and find that they are in some ways bound together by fate.",26910.0
Hey Ram,History|Drama|Crime,Saketh Ram's wife is raped and killed during direct action day riots in Calcutta. He is convinced that Mahatma Gandhi is responsible for all the problems happening in the country. He sets out to kill him.,60579.0
Irudhi Suttru,Drama,"A grumpy boxing coach takes on a young, rebellious woman under his wings and starts training her for the world championship. But their biggest battle has to be fought outside the ring.",357706.0
Love Today,Comedy|Romance,A young couple is made to exchange their phones for a day. What follows is a hilarious and emotional sequence of events that puts their lives in misery.,1032627.0
Baasha,Action,"Auto rickshaw driver Manickam avoids violence at all costs. When some thugs begin to intimidate Manickam's family, it triggers the revival of Manickam's old self.",49074.0
Mankatha,Action|Thriller,"Vinayak, a suspended cop, helps a group of four men rob cricket betting money amounting to 500 crores INR. When it comes to splitting the amount, betrayal hits the team hard and a chase ensues.",76788.0
Theeran Adhigaaram Ondru,Action|Thriller,A hardnosed cop goes after a gang of ruthless dacoits who have been terrorising residents along the highway for a decade.,456218.0
Spyder,Action|Thriller|Crime,A surveillance expert who wants to help people comes across a foe who is the very definition of evil. Can he stop the man before he destroys everything?,452447.0
Maari,Action,"A feared local rowdy, known for his dominance in the streets and pigeon racing, finds himself at odds with a newly appointed police officer. As tensions rise, hidden motives and betrayals unfold, shaking the balance of power in the neighborhood.",311166.0
Jagame Thandhiram,Crime|Drama,"When a clever, carefree gangster is recruited to help an overseas crime lord take down a rival, he is caught off guard by the moral dilemmas that follow.",656113.0
Velaiyilla Pattathari,Drama|Comedy|Action,"Raghuvaran, who is unemployed for years, gets his dream job but a powerful rival is keen to put him down. Can he take on his adversary?",262970.0
Thani Oruvan,Thriller|Action,An idealistic cop and an ambitious scientist-businessman indulge in a high-stake battle of wits.,280165.0
Rocketry: The Nambi Effect,Drama|History,"The story of the great Indian rocket scientist, Shri Nambi Narayanan's life, a true patriot, who was turned into a villain in the blink of an eye after being falsely accused of treason.",607145.0
Ko,Action|Thriller,"Ashwin is a photographer, covering the upcoming elections for a newspaper. His life gets entangled with politics when one of his published photographs upsets a corrupt political party.",63654.0
Star,Drama|Romance,"Follows a youngster Kalai and his aspirations of becoming a 'Star' in the Tamil Film Industry. Born in a lower-middle-class family, will Kalai overcome all his struggles to emerge as a Star?",1276338.0
Kaaka Muttai,Drama,Two slum kids yearn to taste a pizza after being enticed by the pizza shop that has opened near their locality. What happens when they manage to find the money to buy one?,264038.0
Roja,Drama|Action|Romance,"Roja, a simple girl from a village in Tamil Nadu, makes desperate efforts to find her husband, Rishi, after he is kidnapped by militants during a secret undercover mission in Kashmir.",21463.0
Vaaranam Aayiram,Drama|Romance,"A son deals with the death of his father and examines how their relationship influences him through growing up, romance, tragedy and adventure.",38637.0
Dasavatharam,Action|Adventure,Bio-technologist Govind K Somaiyya sets about on a precarious journey to India to retrieve a vial containing a deadly virus and prevent it from reaching the wrong hands of an ex-CIA agent and deadly assassins.,17888.0
Aadukalam,Action|Drama|Thriller,"Pettaikaaran is famous in his town for an impeccable track record of successes in rooster fights. When one of his aides, Karuppu, goes against his word in a fight, it leads to an enmity between them.",68016.0
Raja Rani,Romance|Comedy|Drama,"John and Regina, who dislike each other, are forced to get married and lead troubled lives. However, things take a turn when the couple suffers a sudden tragedy.",224330.0
Thalaivaa,Action|Drama|Thriller,A mafia don sends his son out of the country because he doesn't want even a shadow of his life falling on him. Destiny wills otherwise. The son makes an innocuous trip to Mumbai to visit his dad. And ends up filling his father's large shoes.,202616.0
Vivegam,Action|Thriller,"A group of counter-terrorism agents are brought in to track down a man who was once the head of their squad, and is believed to have gone rogue.",438731.0
O Kadhal Kanmani,Romance|Drama,"Aadi and Tara fall in love but both hate the idea of marriage and plan to separate when their lives take them to different countries. However, as they grow closer, their emotions are not easily managed.",329135.0
Kannum Kannum Kollaiyadithaal,Romance|Comedy|Drama,Two wily online scammers mend their fraudulent ways after meeting the girls of their dreams — until a deceitful discovery throws their world for a loop.,505951.0
Velayudham,Action,An ordinary milkman is forced to become the fictional character Velayudham who takes on the scum of the earth.,63634.0
3,Drama|Romance,"Ram and Janani are high school sweethearts who eventually get married. However, Janani is mystified when Ram commits suicide all of a sudden and she tries to find out the truth behind his death.",79660.0
DSP,Action|Drama,"A flower seller's son ends up in a tussle with a ruthless rowdy in Dindigul, forcing him to become a policeman and fight the odds.",806920.0
Imaikkaa Nodigal,Action|Thriller|Drama|Crime,A CBI officer goes in search of a ruthless serial killer. Things get worse when the murderer targets the former and her family,415193.0
Pariyerum Perumal,Romance|Drama,"A law student from a lower caste begins a friendship with his classmate, a girl who belongs to a higher caste, and the men in her family start giving him trouble over this.",462718.0
Bairavaa,Action,A loan recovery agent takes on a corrupt head of an educational institution to save his girlfriend.​,411717.0
Kabali,Action|Crime|Drama,A gangster in Malaysia goes in search of his family after 25 years of imprisonment.,366080.0
Naai Sekar Returns,Comedy,"Naai Sekar, who decides to make money by kidnapping dogs, learns about his pet dog which was taken away from their family during his childhood. Can he rescue his dog, which is considered as a lucky charm?",882397.0
Pizza,Thriller|Comedy|Romance|Horror,"Michael, a pizza delivery boy, lives with Anu, an aspiring horror fiction writer. One day, on a delivery run, he goes to a bungalow, where mysterious events begin to unfold.",139357.0
Yennai Arindhaal,Thriller|Action,"Sathyadev, who is on a career break, is forced to put on his cop shoes ones again to save Thenmozhi, a young woman who is the target of a criminal organ harvesting group, led by a ghost from his past.",300983.0
Vedalam,Action,"Ganesh, a cab driver and a doting brother to his sister Tamizh, is hunting down three notorious criminals in Kolkata. Who is he actually and what's his motive?",362150.0
The Elephant Whisperers,Documentary,"Bomman and Bellie, a couple in south India, devote their lives to caring for an orphaned baby elephant named Raghu, forging a family like no other.",1041580.0
Dhuruvangal Pathinaaru,Thriller|Action|Crime|Mystery,A former cop looks back on the case which left him disabled and forced him to quit the force.,414523.0
Game Over,Thriller|Mystery|Drama,"Swapna, a nyctophobic game designer on a turbulent road to recovery from an incident that scarred her deeply, has to fight her inner demons to stay alive in the game called life.",553456.0
Thupparivaalan,Action|Crime|Thriller,Detective Kaniyan Poonkundran is hungry for a challenging case to investigate and the mystery of a murdered dog leads to a rival who could be the match for him.,410481.0
U Turn,Thriller|Horror|Crime,"When a flyover in the city becomes the hotbed of accidents, a young reporter decides to investigate the issue. Her quest for an answer would lead her into a web of intrigue, murder and mystery.",535657.0
Hello,Romance|Drama,"Chandru's friends make fun of him as he does not have a girlfriend. He points out at a girl claiming that she is his girlfriend, due to which a number of unfortunate events take place in her life.",277875.0
Chekka Chivantha Vaanam,Action|Crime|Thriller,A bloody power struggle erupts between three brothers who are vying to take over the family business following the death of their father.,504184.0
Soodhu Kavvum,Comedy|Thriller|Crime,Dass specialises in small time kidnapping and has his own set of rules. The primary and most important among them is not to get involved with influential people. Three jobless youngsters meet Dass and the four take up an assignment for a hefty sum that throws away this primary rule and end up being chased by a dreaded policeman.,189227.0
Maanagaram,Thriller|Action,"Upon moving to Chennai, four lives get intertwined as they strive to achieve success in the city. However, when a vicious gangster threatens them, the group must work together to defeat him.",412096.0
Aruvi,Drama,A gentle girl born and brought up amidst the ever growing eco-social-consumeristic environment finds it difficult to fit in the society. She decides to take it hard on the people.,423191.0
