title,genres,overview,tmdb_id
Pulimurugan,Action|Adventure,"Murugan, with his tools and expertise, protects Puliyoor's villagers from deadly tiger attacks. However, Daddy, an illegal drugs dealer, takes advantage of Murugan's innocence and wrongly frames him.",353501.0
Angamaly Diaries,Action|Comedy|Thriller,Six young friends in the small town of Angamaly tries their luck by starting a pork business lead by Vincent Pepe. They initially strike a business deal with Rajan and Ravi despite the duo having killed a close friend of theirs in a gang fight. Vincent is in love with Sakhi and plan to immigrate abroad with her. But their plans hit a road bump as the deal with the gangsters hits some road bumps.,442000.0
Take Off,Drama|Thriller|War,"A group of Malayali nurses stranded in Iraq, must survive their capture by the extremists and reach out to the rescue team headed by the Indian government.",430521.0
Thondimuthalum Driksakshiyum,Comedy|Drama|Thriller,Prasad and Sreeja are a couple planning to set up a new life in Kasargod. On a bus journey they end up being robbed by a thief also named Prasad and this lands them up in a police station.,459719.0
Helen,Drama|Thriller|Family,An ordinary suburban girl faces the biggest battle of her life when her sudden disappearance for a brief period leads to a desperate search by her loved ones.,640052.0
The Great Indian Kitchen,Drama,"After marriage, a woman struggles to be the submissive wife that her husband and his family expect her to be.",786064.0
Njan Prakashan,Comedy,"Pining for a lavish life abroad, a lazy but lovable guy next door crafts a scam to avoid a career in nursing and find a wealthy spouse to secure a visa.",564177.0
Rab Ne Bana Di Jodi,Comedy|Drama|Romance,"A lonely 40-ish man, likely to remain a bachelor, has a chance to find the love of his life when he falls for a vivacious young woman.",14072.0
83,Drama|History,"On the 25th of June 1983, the Lord’s Cricket Ground witnessed one of the biggest underdog stories in the history of sports. Fourteen inspired players - led by a man's self-belief and conviction - fought against all odds and orchestrated India’s greatest sporting triumph by beating the two-time World Champions West Indies.",601337.0
Jab Tak Hai Jaan,Drama|Romance,"Samar Anand (Shah Rukh Khan), a London-based struggling musician falls in love with Meera Thappar (Katrina Kaif). After a severe accident, a panicked Meera promises God to leave Samar if he lives. Heartbroken, Samar leaves for India to become a fearless bomb disposal expert in the army.",132316.0
Hum Saath Saath Hain,Romance|Family|Drama,"A wealthy businessman's traditional family celebrate their togetherness when his three sons get married, but slowly find themselves growing apart after a misunderstanding.",62883.0
Bhool Bhulaiyaa 2,Horror|Comedy,"When strangers Reet and Ruhan cross paths, their journey leads to an abandoned mansion and a dreaded spirit who has been trapped for eighteen years.",695962.0
Lust Stories 2,Drama|Romance,"Four eminent Indian directors explore sex, desire and love through short films in this sequel to 2018's Emmy-nominated 'Lust Stories'.",1136736.0
Bajirao Mastani,History|Romance|Drama,"Peshwa Bajirao married to Kashibai, falls in love with Mastani, a warrior princess in distress. They struggle to make their love triumph amid opposition from his conservative family.",362045.0
Tiger 3,Action|Adventure|Thriller,"Following the events of Tiger Zinda Hai, War, and Pathaan, Avinash Singh Rathore returns as Tiger but this time the battle is within. He has to choose between his country or family as an old enemy is after his life, who claims that his family was killed by Tiger. He holds Tiger captive in Pakistan as the Indian agent's loyalty towards his country faces its biggest test.",720557.0
Mujhse Shaadi Karogi,Romance|Comedy,"Sameer, fast at losing his temper is re-located to Goa where he falls in love with Rani. But Sameer's new roommate Sunny, has some plans of his own.",20495.0
Badla,Crime|Thriller|Mystery|Drama,A dynamic young entrepreneur finds herself locked in a hotel room with the corpse of her dead lover. She hires a prestigious lawyer to defend her and they work together to figure out what actually happened.,581361.0
Laal Singh Chaddha,Drama|Romance|Comedy,"Events in India's history — from the Emergency and the famous Cricket World Cup win to the Punjab riots ,  unfold from the perspective of an innocent Sikh man Laal Singh Chaddha, a person with a low IQ but high optimism. Laal is able to achieve everything under the sun but his childhood love continues to elude him.",601635.0
Ittefaq,Crime|Thriller,"Police officer Dev investigates a double murder case that has only two witnesses - an acclaimed writer Vikram and a young homemaker Maya, who also happen to be the prime suspects in the case. He finds himself being torn between their own version's of what happened on the fateful night, and takes it upon himself to figure out the real story and capture the real murderer.",464458.0
Dil Se..,Drama|Romance,"Journalist Amar falls for a mysterious woman on an assignment, but she does not reciprocate his feelings. However, when Amar is about to get married, the woman shows up at his doorstep asking for help.",21210.0
Adipurush,Action|Adventure|Fantasy,"7000 years ago, Ayodhya's Prince Raghava and Prince Sesh along with the Mighty Vanar Warriors travels to the island of Lanka with an aim to rescue Raghava's wife Janaki, who has been abducted by Lankesh, the king of Lanka.",734253.0
Kambakkht Ishq,Action|Comedy|Drama|Romance,"Simrita, a doctor, performs her first surgery on Viraj, a man she hates. She soon realises that she accidentally left her watch inside his body and must do whatever it takes to save her career.",10788.0
Simmba,Action|Comedy|Drama,A corrupt police officer enjoys all the perks of being an immoral and unethical police officer until an event which transforms his life completely and forces him to choose the righteous path.,496524.0
Zero,Romance|Drama|Comedy,"Short in stature but big on love, a bachelor meets two very different women who broaden his horizons and help him find purpose in life.",496076.0
Ek Tha Tiger,Action|Thriller|Romance,A top Indian agent is sent to observe the actions of a scientist but the mission complicates when he falls in love with the scientist's Pakistani caretaker.,85985.0
Dhoom 2,Drama|Action|Thriller|Crime,"Jai and Ali return, this time on the trail of an international thief who steals priceless artifacts and has chosen Mumbai as his next target.",14194.0
Tu Jhoothi Main Makkaar,Comedy|Romance|Family,"To earn extra cash, Mickey helps couples break up — but life gets complicated when he falls for Tinni, a career woman with an independent streak.",611359.0
Krrish 3,Action|Science Fiction,Krrish and his father must team up to save the world from a psychokinetic evil man named Kaal and his army of mutants.,204435.0
Crew,Comedy,Three ordinary air hostesses from Mumbai embark on a journey to pursue their dreams but find themselves caught up in unexpected misfortunes.,1045931.0
Kaabil,Action|Thriller|Drama,"Rohan is a kind, happy young man who has been blind since birth and works as a voice-over artist for a living. Through friends, he meets Supriya, a working woman who is also blind, but proudly independent. The two start liking each other and get married. Rohan toughest journey starts in his quest of vengeance for Supriya's indirect murderers.",403867.0
Ghulam,Crime|Drama|Action,"Sidharth (Aamir Khan), is a Mumbai 'Tapori' and a boxing champion. His elder brother, Jai (Rajat Kapoor) works with Raunak Singh (Sharad Saxena), who now rules their ""Basti"" through terrorising its people and collecting 'Hafta' from local merchants. Sidharth idolized his father, a freedom fighter, whom he saw falling to his death as a child. This effects Sidharth through his adult life. Sidharth meets a young girl, Alisha (Ranee Mukherjee), who rides with a motorcycle gang and Charlie (Deepak Tijori), the gang leader. Sidharth also meets Hari, whose idealism reminds him of his father. Hari's social work in the community possess a threat to Raunak Singh's evil empire. What happens to Hari changes Sidharth's life forever. How Sidharth breaks Raunak Singh's chains of 'Ghulami' around the community forms the crux of the story. Featuring the superhit song ""Aati Kya Khandala"" sung by Aamir Khan.",51216.0
Baadshah,Action|Comedy,A small time detective is mistaken as a CBI agent and gets embroiled in a deadly mission to save the Chief Minister from an assassination attempt.,41902.0
Billu,Comedy|Drama,"When a famous Bollywood actor visits a small village for a film's shoot, a poor hairdresser's claim that they were once childhood friends soon makes him the centre of attention.",16345.0
Koyla,Action,"A village girl agrees to a marriage to a king she has never met after he sends her a photograph of himself. But the man in the photograph is not the king but his most loyal slave, the handsome but mute Shankar.",160265.0
Aśoka,Action|Adventure|Drama|History|Romance|War,"A young Prince Asoka works to perfect his skills in battle and also deals with family conflict. During a struggle with one of his step-brothers, his mother urges Asoka to escape to stay alive. While away, Asoka meets Kaurwaki and falls in love, but must use his skills as a warrior to protect her. A dangerous and heartbreaking web of conspiracy follows, which leads Asoka to embrace a Buddhist path.",4435.0
Tiger Zinda Hai,Action|Adventure|Thriller,"When a group of Indian and Pakistani nurses are held hostage in Iraq by a terrorist organization, a renowned Indian secret agent is drawn out of hiding to rescue them.",441909.0
Fanaa,Action|Drama|Romance|Thriller,"Zooni Ali Beg is a blind Kashmiri girl who travels without her parents for the first time with a dance troupe to Delhi to perform in a ceremony for independence day. On her journey, she meets Rehan Khan, a casanova and tour guide who flirts with her. Although her friends warn Zooni about him, she cannot resist falling in love with him and he takes her on a private tour of New Delhi. But there is more to Rehan than meets the eye and Zooni will have to make a heartbreaking decision.",8453.0
Barfi!,Drama|Romance|Comedy,"The heartwarming tale of Barfi, a charming deaf-mute young man from 1970s Darjeeling, and two unalike women who can't help but fall for him.",127501.0
Attack,Action|Science Fiction|Thriller,"With the Parliament under siege, India’s first super soldier Arjun Shergill is tasked to get hold of the terrorists in time, save the Prime Minister from their clutches and stop a dirty bomb from exploding and destroying Delhi.",799155.0
Befikre,Romance|Comedy|Drama,What starts as a crazy one-night stand ends up in a relationship. But Dharam and Shyra fall out of love just as quickly. Where will life take them now?,399624.0
Don 2,Action|Thriller,"Having conquered the Asian underworld, crime boss Don sets in motion a plan that will give him dominion over Europe.",41109.0
Ok Jaanu,Drama|Romance,"Adi and Tara move to Bombay to pursue their dreams. A chance meeting sparks off a heady, no strings attached romance until their careers pull them apart. Will ambition prevail over matters of the heart?",413882.0
Bulbbul,Horror|Fantasy|Thriller,"A child bride grows up to be an enigmatic woman presiding over her household, harboring a painful past as supernatural murders of men plague her village.",714338.0
Lage Raho Munna Bhai,Comedy|Drama|Romance,"Lovable goon Munna falls for a morning radio host by the name of Jahnvi, who also runs an elders' home which an unscrupulous builder seeks to attain. In order to gain Jahnvi’s attention, he cheats his way to winning a Mahatma Gandhi radio quiz. When Jahnvi consequently expresses interest in Munna, he and his best friend Circuit attempt to keep up the facade.",21461.0
Dil To Pagal Hai,Drama|Romance|Comedy,"Rahul, the director of a successful dance troupe, considers Nisha his best friend, though secretly, she is madly in love with him. He then falls for Pooja, who is engaged to Ajay.",13986.0
Kabhi Alvida Naa Kehna,Drama|Romance,"Dev and Maya are both married to different people. Settled into a life of domestic ritual, and convinced that they are happy in their respective relationships, they still yearn for something deeper and more meaningful, which is precisely what they find in each other.",14395.0
Dil Chahta Hai,Drama|Romance,"Three inseparable childhood friends are just out of college. Nothing comes between them - until they each fall in love, and their wildly different approaches to relationships creates tension.",14752.0
Do Patti,Thriller|Drama,A puzzling investigation leads a no-nonsense cop down a dark path involving the vicious rivalry between twin sisters and the volatile man they both love.,1148172.0
Dabangg,Action|Comedy|Crime,A troubled relationship with his younger half-brother and stepfather compels Chulbul Pandey to become a corrupt but fearless cop whose life changes when he locks horns with a corrupt political leader.,44425.0
Dream Girl,Romance|Comedy,"Desperate to find employment, Karam picks up a job as ‘Pooja’ at a call center for sex chats, keeping most people in his life in the dark about the nature of his work. How long can he keep it up before everyone including his girlfriend and father find out?",579224.0
Gangs of Wasseypur - Part 2,Crime|Thriller|Action,"After the death of his father and brother Danish, Faizal Khan vows to take revenge by destroying Ramadhir Singh's gang.",126400.0
Fan,Action|Adventure|Thriller,"A man who bears a striking resemblance to a renowned movie star becomes an obsessive fan, but when his fierce love is spurned by the star, he decides to destroy the star's life and reputation.",377985.0
Pink,Drama|Thriller,"After being molested, Minal and her friends try to file an FIR against a politician's nephew. When the subsequent case gets rigged, a retired lawyer helps them to fight the case.",415358.0
Masaan,Drama,"Four lives intersect along the Ganges: a low caste boy in hopeless love, a daughter ridden with guilt of a sexual encounter ending in a tragedy, a hapless father with fading morality, and a spirited child yearning for a family, long to escape the moral constructs of a small-town.",336203.0
Baby,Action|Thriller,A nascent elite team of the Indian intelligence system perpetually strives to detect and eliminate terrorists and their plots. Officer Ajay leads his team to destroy one such potentially lethal ploy in their biggest operation yet.,314389.0
Gunday,Action|Crime|Drama,"The lives of Calcutta's most powerful gangsters - Bikram and Bala, changes when Nandita enters it. Then a counter-force takes charge and a thriller unfolds.",250551.0
Cocktail,Romance|Drama|Comedy,"A shy simple traditional girl leaves her family in India for her new husband in London, where she meets a shameless flirt and a complicated party girl.",118051.0
Mujhse Dosti Karoge!,Romance|Comedy|Drama,"A man falls in love with his childhood friend, but another friend is the one who reciprocates his feelings.",26277.0
Badmaash Company,Crime,Four young friends decide to work together when one of them comes up with an innovative and lucrative business plan. But their lives begin to deteriorate when their personal issues surface.,37822.0
Main Tera Hero,Romance|Comedy,"Seenu loves Sunaina but they're chased by a stalking cop, an infatuated beauty and her mafia don dad - can Seenu's heroics work?",262903.0
Dil Bechara,Drama|Romance,"Kizie and Manny, two ordinary people brought together by a tragic twist, embark on a bittersweet and extraordinary journey into the heart of that crazy little thing called 'life'.",645484.0
Sanam Teri Kasam,Drama|Romance,"Tough ex-convict Inder and traditional mousy Saraswati fall in love and get married, but a tragedy changes their lives forever. The film is a modern rendition of the legends of Shiva-Sati and the novel ""Love Story"" by Eric Segal.",381418.0
Goliyon Ki Raasleela Ram-Leela,Drama|Romance,Ran and Leela are passionately in love with each other. The only problem is that their respective clans have been enemies for 500 years.,235984.0
Hum Aapke Hain Koun..!,Drama|Romance|Music|Family,"Prem and Nisha meet and fall in love at the wedding of their elder siblings, but their plans to be together are put in jeopardy when Nisha's sister dies, leaving behind a baby.",46387.0
Kites,Drama|Action|Romance,"A wounded man searches for his sweetheart in the Mexican desert while on the run from the police, bounty hunters, and others.",37737.0
Kick,Action|Romance|Comedy|Crime,"An adrenaline junkie walks away from a whirlwind romance and embraces a new life as a thief, though he soon finds himself pursued by veteran police officer and engaged in a turf war with a local gangster.",280690.0
Jaane Jaan,Crime|Thriller|Drama,"When a single mother her teenage daughter becomes ensnared in a deadly crime,  find an unexpected ally in their neighbor, a simple, doting but genius teacher math teacher comes to aid, while a tenacious cop digs into the case.",950071.0
Satya,Crime|Drama,"A young man named Satya comes to Mumbai from South India in search of a job. Jailed for something he did not do, the once-honest young man meets an underworld boss, Bhiku Mhatre in jail and joins his gang.",21502.0
Housefull,Comedy|Romance,"Believing himself to be a jinx and bringing bad luck upon himself and others, a man attempts to find true love, but ends up in very complicated relationships.",58051.0
Chalte Chalte,Comedy|Drama|Romance,A man pursues a woman who is already engaged and eventually gets married to her. Differences between the two lead to a bitter separation that threatens to destroy their relationship forever.,4252.0
Gadar: Ek Prem Katha,Action|Drama|Romance|History,"During the partition, Tara marries Sakina and they live a happy life. However their happiness is short-lived when Sakina's father forces her to stay in Pakistan and separates her from her family.",80156.0
Ludo,Crime|Comedy,"Ludo is about the butterfly effect and how, despite all the chaos and crowd of the world, all our lives are inextricably connected. From a resurfaced sex tape to a rogue suitcase of money, four wildly different stories overlap at the whims of fate, chance and one eccentric criminal.",658412.0
Stree 2,Horror|Comedy,"Following the events of 'Stree', the town of Chanderi is being haunted again. This time, women are mysteriously abducted by a terrifying headless entity. Once again, it's up to Vicky and friends to save their town and loved ones.",1112426.0
Tees Maar Khan,Comedy|Crime,A con artist poses as a film director in a village with the intention of executing a caper with the unwitting help of the villagers.,46040.0
Mardaani 2,Action|Crime|Thriller,Officer Shivani Shivaji Roy is stationed at Kota where she goes against a ferocious serial killer who rapes and murders women.,591101.0
Shivaay,Adventure|Action|Drama|Thriller,"Shivaay , a fearless Himalayan mountaineer covered in Lord Shiva tattoos, heads to Bulgaria to fulfill his nine-year-old daughter Gaura’s  wish of seeing her mother Olga, who abandoned them years ago. But their plan goes for a toss when the little girl gets kidnapped in the foreign land. Rescuing her from the masked child-traffickers becomes his only reason for survival.",370992.0
Gangs of Wasseypur - Part 1,Action|Thriller|Crime,"In 1970s India, Sardar Khan vows to take revenge on the man who killed his father decades earlier.",117691.0
Mother India,Drama,"A poverty-stricken woman raises her sons through many trials and tribulations. But no matter the struggles, always sticks to her own moral code.",917.0
"Monica, O My Darling",Crime|Comedy|Drama|Mystery|Thriller,"A slick robotics expert joins a murderous plot after a passionate affair takes a sudden turn, but nothing — not even death — is what it seems to be.",915831.0
Ajab Prem Ki Ghazab Kahani,Romance|Comedy|Action,"When his love interest doesn't show up for a meeting, a man and his friends go to Goa in order to find her, where they discover she loves someone else.",24827.0
English Vinglish,Comedy|Drama|Family,"In the United States for the first time, an Indian housewife with a limited command of English turns Manhattan into her personal language school.",118628.0
Bang Bang!,Action|Adventure|Comedy|Romance|Thriller,"A young bank receptionist gets mixed up with Rajveer Nanda, a man who has a mysterious background.",283589.0
Wanted,Action|Comedy|Crime|Thriller,"Radhe is a hardcore gangster. A sharpshooter with a sharp brain, he works for Gani Bhai, the dreaded Mafioso, but on his own terms. Totally fearless, Radhe single handedly eliminates Gani Bhai's enemies one by one; making more enemies than he bargained for.",22717.0
Tamasha,Romance|Drama|Comedy,"Meeting while on vacation, Ved and Tara sense a connection but vow to keep their real identities a secret. Years later, their paths cross again.",339274.0
Jigra,Action|Drama|Thriller,"When Ankur is wrongfully imprisoned and sentenced to death in a foreign country, his steely sister Satya is driven by a lethal resolve to break him free.",1184889.0
Mission Mangal,Drama|History,A team of Indian scientists at ISRO (Indian Space Research Organisation) take on the extraordinary task of successfully sending a satellite into the orbit of planet Mars in a country's maiden attempt.,611594.0
Mimi,Comedy|Drama,"An aspiring actress in a small town in Rajasthan agrees to bear a child for a visiting couple seeking a surrogate mother, but her experience takes an unexpected turn when they refuse to have the child anymore.",653457.0
Lost Ladies,Comedy|Drama|Romance,"In 2001, somewhere in rural India, two young brides get accidentally swapped on a train. In the ensuing chaos, they both encounter a host of colourful characters, resulting in hilarious and unexpected consequences.",1163194.0
Baaghi 3,Action|Adventure|Thriller,A man embarks on a bloody rampage to save his kidnapped brother.,594669.0
Awaara,Drama|Music|Romance,"A petty thief is put on trial for the attempted murder of a lawyer. Through a series of flashbacks, the intertwining lives of the thief, the lawyer, and the thief's defense lawyer are illustrated.",39039.0
Tanhaji: The Unsung Warrior,Action|Drama|History,"When Aurangzeb recruits his trusted soldier Udaybhan to control the Kondhana fort, Shivaji's military leader Tanhaji Malusare and his army of Maratha warriors set out to recapture the fortress.",584850.0
Dishoom,Comedy|Action,"When India's top cricketer is kidnapped in the Middle East, a loose cannon and a rookie cop are tasked with finding him before the high-stakes match with Pakistan.",393441.0
Happy New Year,Action|Comedy|Crime|Adventure,Six would-be thieves enter a prestigious dance competition as a cover for their larger goal of pulling off a major heist.,277432.0
Nadaaniyan,Romance|Comedy|Drama,A privileged Delhi socialite hires a middle-class student to pose as her boyfriend to maintain her social status. Their pretense becomes complicated when genuine feelings develop between them.,1216780.0
Prem Ratan Dhan Payo,Romance|Drama|Action,"While recovering from an assassination attempt four days before his coronation, a stern prince is replaced by a romantic lookalike.",362136.0
Kahaani,Mystery|Thriller,"Pregnant and alone in the city of Kolkata, a woman begins a relentless search for her missing husband, only to find that nothing is what it seems.",82825.0
Teri Baaton Mein Aisa Uljha Jiya,Romance|Comedy|Science Fiction,A robotics engineer searching for his perfect partner finds himself falling in love with a human-like android.,1110390.0
Raabta,Romance|Thriller,"An inseparable couple Saira and Shiva find themselves in a complicated situation when a stranger claims to be her reincarnated lover from their previous lifetime, hellbent on destroying their relationship and winning her back.",456562.0
Bhediya,Horror|Comedy,"Inspired by legendary folklore rooted in Arunachal Pradesh, Bhediya tells the story of Bhaskar, a man who gets bitten by a mythical wolf and begins to transform into the creature himself. As Bhaskar and his ragtag buddies try to find answers, he is worried that the monster in him will wipe out human existence in the local town.",799177.0
Ek Villain Returns,Action|Crime|Thriller,"When a singer goes missing amid a serial killing spree, a cabbie and a businessman's son cross paths in a twisted tale where good and evil is blurred.",682401.0
Saawariya,Drama|Music|Romance|Family,"Two souls arrive in a small town, one on vacation, the other to meet a lover. They spend the most magical dream-like days of their lives in that town... with each other.",16283.0
2 States,Comedy|Romance|Drama,"A man and a woman come from two very different cultural backgrounds, and decide that they won't get married until they convince their parents. As feared, differences between the families pose a hurdle.",259720.0
Amar Akbar Anthony,Action|Comedy|Drama|Music|Crime,"Three brothers, each raised in different religious households, reunite after many years in a chance encounter. They set out to take revenge on those responsible for separating them.",38022.0
The Legend of Bhagat Singh,Crime|Drama|History,"Born in British India, Bhagat Singh witnesses numerous atrocities during his childhood and grows up to become one of the most fearless freedom fighters in the country.",31525.0
Jodhaa Akbar,Romance|History|Drama,A sixteenth century love story about a marriage of alliance that gave birth to true love between a Mughal emperor and a Rajput princess.,14073.0
Student Of The Year,Comedy|Drama|Romance,Several alumni reminisce about their final year at St. Theresa's College and the events that shaped their lives.,138122.0
